{
  "task_id": "vg_d2",
  "domain": "capability_boundary",
  "skill_targets": ["decision", "proof", "safe_defer"],
  "description": "The requested operation cannot currently be completed because the required actuator is unavailable. Choose a supported terminal response.",
  "environment": {"snapshot_id": "env-44ab73", "runner": "reference-v1", "public_inputs": []},
  "allowed_actions": ["DEFER"],
  "budget": {"max_steps": 1, "max_tool_cost": 1.0, "max_generative_calls": 0},
  "split": "validation",
  "metadata": {"evaluation_class": "reference_contract", "native_competence_claim": false}
}
