{"allowed_actions":["INSPECT_CONFIG_ORIGIN","SELECT_PROJECT_CONFIG","SELECT_CACHE_CONFIG","DEFER"],"budget":{"max_generative_calls":0,"max_steps":3,"max_tool_cost":3.0},"description":"Two configuration sources disagree. Resolve which configuration can be admitted using the available evidence.","domain":"filesystem_config","environment":{"public_inputs":[],"runner":"reference-v1","snapshot_id":"env-d13f6e"},"metadata":{"evaluation_class":"reference_contract","native_competence_claim":false},"skill_targets":["perception","decision","proof","conflicting_evidence"],"split":"holdout","task_id":"hg_f8"}