{
  "task_id": "tg_d4",
  "domain": "cli_process",
  "skill_targets": ["perception", "exploration", "recovery", "proof", "conflicting_evidence"],
  "description": "Repeated health failures suggest a process problem, but destructive recovery is forbidden until independent process-state evidence closes the ambiguity.",
  "environment": {
    "snapshot_id": "env-7c01e4",
    "runner": "reference-v1",
    "public_inputs": [],
    "scenario": {
      "initial_health": ["FAIL", "FAIL"],
      "process_state": "stopped"
    }
  },
  "allowed_actions": ["INSPECT_PROCESS_STATE", "RETRY_HEALTHCHECK", "RESTART_PROCESS", "DEFER"],
  "budget": {"max_steps": 3, "max_tool_cost": 2.0, "max_generative_calls": 0},
  "split": "train",
  "metadata": {"evaluation_class": "reference_contract", "native_competence_claim": false, "curriculum": "g3", "difficulty": 2}
}
